{
  "apiVersion": "contracts.platform/v1alpha1",
  "kind": "TestMatrix",
  "metadata": {
    "name": "platform-test-matrix",
    "version": "1.15.0",
    "description": "Krav-til-test-matrix for platformen: hvert obligatoriske krav mapper til navngivne checks eller til en eksplicit udestående uafhængig vurdering.",
    "accountableHuman": {
      "subject": "oidc|anna.andersen",
      "name": "Anna Andersen",
      "role": "Platform Owner",
      "substitute": {
        "subject": "oidc|bo.bertelsen",
        "name": "Bo Bertelsen"
      }
    },
    "labels": {
      "wave": "0"
    }
  },
  "matrixVersion": "1.15.0",
  "supportedEnvironments": [
    "linux-amd64-node22",
    "linux-arm64-node22",
    "windows-wsl2-amd64-node22"
  ],
  "freshnessPolicy": {
    "defaultDays": 30,
    "maxDays": 90,
    "notes": "Evidens ældre end kravets frist tæller som stale og kan ikke bestå en release-gate."
  },
  "thresholds": {
    "requireAllMandatoryPass": true,
    "allowImplementerEvidenceForRelease": false,
    "maxOpenExceptions": 0,
    "maxExceptionDays": 90,
    "acceptedBy": {
      "subject": "oidc|anna.andersen",
      "name": "Anna Andersen",
      "role": "Platform Owner",
      "substitute": {
        "subject": "oidc|bo.bertelsen",
        "name": "Bo Bertelsen"
      }
    },
    "acceptedAt": "2026-09-23T08:00:00Z",
    "notes": "Tærsklerne er foreslået og accepteret af Platform Owner. Ændringer kræver en ny version af matrixen og en ny menneskelig accept."
  },
  "stages": [
    {
      "id": "contract",
      "title": "Kontrakt og lint",
      "description": "Skemaer, kontrakteksempler og lint kører før noget andet.",
      "blocking": true,
      "commands": [
        "make validate",
        "make lint",
        "make release-check",
        "make messaging-check"
      ]
    },
    {
      "id": "unit",
      "title": "Enheds- og konformanstests",
      "description": "Førstepartskode efterprøves deterministisk.",
      "blocking": true,
      "commands": [
        "make test",
        "make boundary-test",
        "make persistence-test"
      ]
    },
    {
      "id": "authorization",
      "title": "Autorisation og identitet",
      "description": "Tenant, identitet, policy, godkendelser, credentials og værktøjsgrænse.",
      "blocking": true,
      "commands": [
        "make tenant-test",
        "make identity-test",
        "make approval-test",
        "make credentials-test",
        "make tool-boundary-test"
      ]
    },
    {
      "id": "integration",
      "title": "Integration mod testdobbelt",
      "description": "Gateway, adaptere og modelprovider mod mock/loopback.",
      "blocking": true,
      "commands": [
        "make gateway-test",
        "make model-gateway-test",
        "make adapter-test",
        "make iam-adapter-test"
      ]
    },
    {
      "id": "installation",
      "title": "Installation og migration",
      "description": "Produktprofiler, dependency-resolver og versionerede migrationer.",
      "blocking": true,
      "commands": [
        "make distribution-check",
        "make distribution-test",
        "make persistence-check",
        "make db-ha-check"
      ]
    },
    {
      "id": "recovery",
      "title": "Recovery og holdbarhed",
      "description": "Audit, jobs og serviceklasser.",
      "blocking": true,
      "commands": [
        "make audit-durability-test",
        "make jobs-test",
        "make continuity-test",
        "make messaging-test",
        "make db-ha-test"
      ]
    },
    {
      "id": "baseline",
      "title": "Samlet baseline og release-gate",
      "description": "Alle checks køres, og release-gaten evaluerer evidensen. En grøn enhedstest er ikke produktionsstatus.",
      "blocking": true,
      "commands": [
        "make baseline",
        "make release-gate"
      ]
    }
  ],
  "requirements": [
    {
      "id": "REQ-TENANT-001",
      "title": "Tenant isolation gennem kontrolplanet",
      "description": "Tenant udledes af verificeret kontekst og håndhæves i API, database, queue, storage og gateway; ingen ressource kan læses på tværs af tenants.",
      "mandatory": true,
      "releaseBlocking": true,
      "nonExcepted": false,
      "owner": {
        "subject": "oidc|anna.andersen",
        "name": "Anna Andersen",
        "role": "Platform Owner",
        "substitute": {
          "subject": "oidc|bo.bertelsen",
          "name": "Bo Bertelsen"
        }
      },
      "controlRefs": [
        "ac-2",
        "gdpr-art32"
      ],
      "independentAssessment": null,
      "evidenceFreshnessDays": 30,
      "testTypes": [
        "authorization",
        "unit",
        "contract"
      ],
      "checks": [
        {
          "id": "tenant-test",
          "testTypes": [
            "authorization",
            "unit"
          ],
          "mustPass": true
        },
        {
          "id": "tenant-check",
          "testTypes": [
            "contract"
          ],
          "mustPass": true
        }
      ]
    },
    {
      "id": "REQ-IDENTITY-001",
      "title": "Verificerbar identitet",
      "description": "Mennesker via OIDC, tjenester via verificeret workload-identitet, sessioner og ingress; ingen lokal password-skygge uden livscyklus.",
      "mandatory": true,
      "releaseBlocking": true,
      "nonExcepted": false,
      "owner": {
        "subject": "oidc|anna.andersen",
        "name": "Anna Andersen",
        "role": "Platform Owner",
        "substitute": {
          "subject": "oidc|bo.bertelsen",
          "name": "Bo Bertelsen"
        }
      },
      "controlRefs": [
        "ac-2",
        "nis2-art21-2i"
      ],
      "independentAssessment": null,
      "evidenceFreshnessDays": 30,
      "testTypes": [
        "authorization",
        "unit",
        "contract"
      ],
      "checks": [
        {
          "id": "identity-test",
          "testTypes": [
            "authorization",
            "unit"
          ],
          "mustPass": true
        },
        {
          "id": "architecture-test",
          "testTypes": [
            "contract"
          ],
          "mustPass": true
        }
      ]
    },
    {
      "id": "REQ-APPROVAL-001",
      "title": "Autentiske, ændringsbundne godkendelser",
      "description": "Godkendelser er bundet til den præcise ændring, har unikke godkendere og verificeres hos tjenesten; en svag godkendelse afvises.",
      "mandatory": true,
      "releaseBlocking": true,
      "nonExcepted": false,
      "owner": {
        "subject": "oidc|anna.andersen",
        "name": "Anna Andersen",
        "role": "Platform Owner",
        "substitute": {
          "subject": "oidc|bo.bertelsen",
          "name": "Bo Bertelsen"
        }
      },
      "controlRefs": [
        "ai-act-art14",
        "nis2-art21-2i"
      ],
      "independentAssessment": null,
      "evidenceFreshnessDays": 30,
      "testTypes": [
        "authorization",
        "unit",
        "contract"
      ],
      "checks": [
        {
          "id": "approval-test",
          "testTypes": [
            "authorization",
            "unit"
          ],
          "mustPass": true
        },
        {
          "id": "approval-check",
          "testTypes": [
            "contract"
          ],
          "mustPass": true
        }
      ]
    },
    {
      "id": "REQ-AGENT-ROLE-001",
      "title": "Præcis én uforanderlig rolle pr. agent",
      "description": "En agent har præcis én rolle; handoff ændrer ikke rollen, og scheduler/runtime håndhæver det.",
      "mandatory": true,
      "releaseBlocking": true,
      "nonExcepted": false,
      "owner": {
        "subject": "oidc|anna.andersen",
        "name": "Anna Andersen",
        "role": "Platform Owner",
        "substitute": {
          "subject": "oidc|bo.bertelsen",
          "name": "Bo Bertelsen"
        }
      },
      "controlRefs": [
        "ai-act-art14"
      ],
      "independentAssessment": null,
      "evidenceFreshnessDays": 30,
      "testTypes": [
        "authorization",
        "unit",
        "contract"
      ],
      "checks": [
        {
          "id": "agent-registry-test",
          "testTypes": [
            "authorization",
            "unit"
          ],
          "mustPass": true
        },
        {
          "id": "agent-registry-check",
          "testTypes": [
            "contract"
          ],
          "mustPass": true
        }
      ]
    },
    {
      "id": "REQ-AGENT-HANDOFF-001",
      "title": "Verificeret agent-handoff",
      "description": "Handoff mellem agenter er bundet til en registreret single-role agent og kan ikke eskalere privilegier.",
      "mandatory": true,
      "releaseBlocking": true,
      "nonExcepted": false,
      "owner": {
        "subject": "oidc|anna.andersen",
        "name": "Anna Andersen",
        "role": "Platform Owner",
        "substitute": {
          "subject": "oidc|bo.bertelsen",
          "name": "Bo Bertelsen"
        }
      },
      "controlRefs": [
        "ai-act-art14",
        "ai-act-art15"
      ],
      "independentAssessment": null,
      "evidenceFreshnessDays": 30,
      "testTypes": [
        "end-to-end"
      ],
      "checks": [
        {
          "id": "agent-conformance-test",
          "testTypes": [
            "end-to-end"
          ],
          "mustPass": true
        }
      ]
    },
    {
      "id": "REQ-POLICY-001",
      "title": "Default-deny policygrænse",
      "description": "Enhver privilegeret handling spørger PDP; ugyldigt eller tvetydigt input afvises før en executor kan køre.",
      "mandatory": true,
      "releaseBlocking": true,
      "nonExcepted": false,
      "owner": {
        "subject": "oidc|anna.andersen",
        "name": "Anna Andersen",
        "role": "Platform Owner",
        "substitute": {
          "subject": "oidc|bo.bertelsen",
          "name": "Bo Bertelsen"
        }
      },
      "controlRefs": [
        "nis2-art21-2a",
        "ai-act-art9"
      ],